{"checks":[{"actual":"1067371.0","description":"raw rows = kept rows + excluded rows","expected":"1067371.0","group":"reconciliation","id":"recon_rows_closure","pass":true},{"actual":"19287250.56799778","description":"raw GBP = kept GBP + excluded GBP","expected":"19287250.567997552","group":"reconciliation","id":"recon_amount_closure","pass":true},{"actual":"18855533.69799778","description":"sum of class amounts = kept GBP","expected":"18855533.7","group":"reconciliation","id":"recon_class_amounts","pass":true},{"actual":"1033036.0","description":"sum of class rows = kept rows","expected":"1033036.0","group":"reconciliation","id":"recon_class_rows","pass":true},{"actual":"18855533.69799778","description":"sum of monthly revenue = kept GBP","expected":"18855533.69","group":"reconciliation","id":"recon_monthly_sum","pass":true},{"actual":"18855533.69799778","description":"known-customer GBP + guest GBP = kept GBP","expected":"18855533.697999272","group":"reconciliation","id":"recon_customer_plus_guest","pass":true},{"actual":"467739.0","description":"matched + unmatched refund quantity = refunded quantity","expected":"467739.0","group":"reconciliation","id":"recon_refund_qty_closure","pass":true},{"actual":"1067371.0","description":"sheet rows sum to UCI instance count","expected":"1067371.0","group":"reconciliation","id":"recon_sheet_rows","pass":true},{"actual":"22523.0","description":"overlap rows excluded = rows of sheet 2 in the overlap window","expected":"22523.0","group":"reconciliation","id":"recon_overlap_identical_copy","pass":true},{"actual":"18855533.69","description":"Monthly product net + non-product net = total net revenue","expected":"18855533.7","group":"reconciliation","id":"overview_sum","pass":true},{"actual":"19643299.89","description":"Family revenue sums to total sale-line revenue","expected":"19643299.89","group":"reconciliation","id":"family_sum","pass":true},{"actual":"18898777.0","description":"Landscape (complete weeks only) does not exceed sale revenue","expected":"<= sales","group":"reconciliation","id":"landscape_le_sales","pass":true},{"actual":"5852","description":"RFM segments partition all included customers","expected":"5852","group":"rfm","id":"rfm_partition","pass":true},{"actual":"16360021.0","description":"RFM segment monetary sums to customer monetary","expected":"16360021.0","group":"rfm","id":"rfm_revenue","pass":true},{"actual":"True","description":"Month-0 retention is 1 for every cohort","expected":"True","group":"cohorts","id":"cohort_m0","pass":true},{"actual":"True","description":"All retention cells lie in [0, 1] or are null (censored)","expected":"True","group":"cohorts","id":"cohort_range","pass":true},{"actual":"0","description":"Top 15 published rules recomputed from raw baskets (count and lift)","expected":"0","group":"baskets","id":"basket_recount","pass":true},{"actual":"39516","description":"Basket count = distinct invoices with a sale line","expected":"39516","group":"baskets","id":"basket_baskets","pass":true},{"actual":"0.00503593481121571","description":"Every published rule meets the minimum support","expected":"0.005","group":"baskets","id":"basket_min_support","pass":true},{"actual":"True","description":"BG/NBD and Gamma-Gamma optimisers converged","expected":"True","group":"clv","id":"clv_converged","pass":true},{"actual":"0.082","description":"BG/NBD fit recovers simulated parameters within 25% relative error (5,000 simulated customers)","expected":"< 0.25","group":"clv","id":"clv_param_recovery","pass":true},{"actual":"0.0263","description":"Conditional expected purchases match simulated future purchases (total, 5%)","expected":"< 0.05","group":"clv","id":"clv_sim_prediction","pass":true},{"actual":"-1.40%","description":"Holdout predicted repeat total within 10% of actual","expected":"< 10%","group":"clv","id":"clv_holdout_total","pass":true},{"actual":"1.0450155316013328","description":"BG/NBD per-customer MAE below the population-rate baseline","expected":"1.862834036329968","group":"clv","id":"clv_beats_baseline","pass":true},{"actual":"True","description":"Predicted decile means increase with decile","expected":"True","group":"clv","id":"clv_deciles_ordered","pass":true},{"actual":"3","description":"Seasonal-naive baseline evaluated on every series and horizon","expected":"73","group":"forecast","id":"bt_baseline_present","pass":true},{"actual":"44","description":"At least 40 rolling origins","expected":">= 40","group":"forecast","id":"bt_origins","pass":true},{"actual":"0.717","description":"80% empirical intervals cover 70% to 90% of out-of-sample one-step actuals","expected":"0.70 to 0.90","group":"forecast","id":"bt_interval_coverage","pass":true},{"actual":"True","description":"All forecasts and bounds are non-negative and lo <= forecast <= hi","expected":"True","group":"forecast","id":"forecast_nonneg","pass":true},{"actual":"0.0e+00","description":"Vectors reproduce from the reference implementation","expected":"< 1e-9","group":"newsvendor","id":"nv_vectors_reproduce","pass":true},{"actual":"True","description":"Empirical Q* attains the maximum expected profit over all sample points","expected":"True","group":"newsvendor","id":"nv_empirical_optimal","pass":true},{"actual":"True","description":"Normal Q* attains the maximum expected profit on a +/-50% grid","expected":"True","group":"newsvendor","id":"nv_normal_optimal","pass":true},{"actual":"True","description":"Decision equals the conjunction of the published criteria","expected":"True","group":"elasticity","id":"elasticity_consistent","pass":true},{"actual":"None","description":"No elasticity estimate is published when not estimable","expected":"None","group":"elasticity","id":"elasticity_no_number","pass":true},{"actual":"16","description":"Every artifact declares honesty tags","expected":"17","group":"honesty","id":"tags_present","pass":true},{"actual":"5942","description":"Customer keys are a dense 1..N index, not source IDs (no key above customer count)","expected":"5942","group":"privacy","id":"no_raw_customer_ids","pass":true}],"failed":0,"limitations_observed":["Single UK wholesale-like gift-ware company over 24 months; patterns do not generalise to retail at large.","The ledger records shipped lines, not demand: stock-outs, lead times, costs and margins are absent.","Product families are keyword-derived approximations, and the first observed purchase is not always a customer's first.","Seasonal-naive has only one prior year to copy in this data, so it is a weak baseline; skill numbers are relative to it.","Association rules measure co-occurrence in one invoice; the top-lift rules are mostly variants of the same product."],"passed":36,"schema_version":"v1","tags":{"checks":"DERIVED"}}
